{
  "kind": "ai_usage_snapshot",
  "schema_version": "1.0",
  "mode": "range_replacement",
  "dataset_id": "b7c1064a-bdb0-4ea2-9f1d-346d810ab16c",
  "revision": "5",
  "generated_at": "2026-11-03T12:00:00+08:00",
  "timezone": "Asia/Shanghai",
  "source": "manual_aggregate",
  "source_timezone": "Asia/Shanghai",
  "range": {
    "start": "2026-11-02",
    "end_exclusive": "2026-11-03"
  },
  "adapter_version": "1.0.0",
  "days": [
    {
      "date": "2026-11-02",
      "state": "complete"
    }
  ],
  "rows": [
    {
      "date": "2026-11-02",
      "provider": "openai",
      "model": "synthetic-sol",
      "effort": "high",
      "effort_evidence": "reported",
      "time_basis": "request_start",
      "service_tier": "standard",
      "context_class": "short",
      "region": "global",
      "classification": "request_classified",
      "cache_detail": "complete",
      "counts": {
        "input_total": "1000",
        "input_uncached": "200",
        "input_cache_read": "800",
        "input_cache_write_5m": "0",
        "input_cache_write_1h": "0",
        "input_cache_write_30m": "0",
        "input_cache_write_unknown": "0",
        "output_total": "100",
        "output_reasoning_subset": "40"
      }
    }
  ]
}
